{
  "version": "1.0",
  "period": "202606",
  "sampleSize": 165,
  "metrics": {"nps": {"value": 92.12, "unit": "score", "n": 165, "definition": "dashboardSummary.nps.score"}, "overall_satisfaction": {"value": 9.5602, "unit": "10-point average", "n": 40, "definition": "Mean of observed numeric cells in satisfactionCrossData; not respondent-weighted."}, "promo_consent": {"value": 0.503, "unit": "rate", "n": 165, "definition": "dashboardSummary.promoConsent.count / totalRespondents"}, "store_signup": {"value": 0.8545, "unit": "rate", "n": 165, "definition": "dashboardSummary.storeSignup.count / totalRespondents"}, "repeat_customer_share": {"value": 0.429, "unit": "rate", "n": 165, "definition": "customerSegments['回頭客 (Repeat)'] / 100"}},
  "branchRanking": [{"key": "大埔門市", "score": 5, "n": 2}, {"key": "屯門市廣場門市", "score": 4.81, "n": 26}, {"key": "銅鑼灣門市", "score": 4.75, "n": 12}, {"key": "太古康怡廣場門市", "score": 4.67, "n": 3}, {"key": "沙田門市", "score": 4.67, "n": 15}, {"key": "旺角銀行中心門市", "score": 4.63, "n": 29}, {"key": "將軍澳東港城門市", "score": 4.6, "n": 5}, {"key": "荃灣綠楊坊門市", "score": 4.6, "n": 25}, {"key": "觀塘鱷魚恤中心門市", "score": 4.53, "n": 14}, {"key": "元朗服務點", "score": 4, "n": 2}],
  "destinationDemand": [{"key": "日本", "value": 31}, {"key": "長江三峽", "value": 28}, {"key": "越南", "value": 24}, {"key": "絲路", "value": 24}, {"key": "韓國", "value": 24}, {"key": "東南亞", "value": 17}, {"key": "北京", "value": 16}, {"key": "雲南", "value": 16}],
  "sentiment": [{"key": "positive", "label": "Positive", "count": 28, "rate": 0.595745}, {"key": "suggestion", "label": "Suggestion", "count": 13, "rate": 0.276596}, {"key": "negative", "label": "Negative", "count": 6, "rate": 0.12766}],
  "customerValueChain": {"status": "partial", "stages": [{"key": "recommendation", "value": 155, "unit": "promoters", "n": 165, "sourceRefs": [{"kind": "month", "month": "202606", "section": "dashboardSummary.nps", "recordKey": "dashboardSummary.nps.promoterCount", "path": "data/202606.json#/dashboardSummary/nps/promoterCount"}]}, {"key": "consent", "value": 83, "unit": "respondents", "n": 165, "sourceRefs": [{"kind": "month", "month": "202606", "section": "dashboardSummary.promoConsent", "recordKey": "dashboardSummary.promoConsent.count", "path": "data/202606.json#/dashboardSummary/promoConsent/count"}]}, {"key": "member_consent_joint", "value": 17, "unit": "member-consent cells", "n": 23, "sourceRefs": [{"kind": "month", "month": "202606", "section": "memberConsentCrossData", "recordKey": "memberConsentCrossData.datasets[0].data[0]", "path": "data/202606.json#/memberConsentCrossData/datasets/0/data/0"}, {"kind": "month", "month": "202606", "section": "memberConsentCrossData", "recordKey": "memberConsentCrossData.datasets[1].data[0]", "path": "data/202606.json#/memberConsentCrossData/datasets/1/data/0"}]}, {"key": "customer_segment_repeat", "value": 0.429, "unit": "rate", "n": 165, "sourceRefs": [{"kind": "month", "month": "202606", "section": "customerSegments", "recordKey": "customerSegments['回頭客 (Repeat)']", "path": "data/202606.json#/customerSegments/回頭客 (Repeat)"}]}, {"key": "store_signup", "value": 141, "unit": "respondents", "n": 165, "sourceRefs": [{"kind": "month", "month": "202606", "section": "dashboardSummary.storeSignup", "recordKey": "dashboardSummary.storeSignup.count", "path": "data/202606.json#/dashboardSummary/storeSignup/count"}]}], "links": [{"key": "member_to_consent", "source": "memberConsentCrossData", "from": "member_status:是會員", "to": "consent:同意", "count": 17, "n": 23, "sourceRefs": [{"kind": "month", "month": "202606", "section": "memberConsentCrossData", "recordKey": "memberConsentCrossData.datasets[0].data[0]", "path": "data/202606.json#/memberConsentCrossData/datasets/0/data/0"}, {"kind": "month", "month": "202606", "section": "memberConsentCrossData", "recordKey": "memberConsentCrossData.datasets[1].data[0]", "path": "data/202606.json#/memberConsentCrossData/datasets/1/data/0"}]}], "unavailable": false, "unavailableLinks": ["recommendation_to_consent", "consent_to_repeat_purchase"]},
  "sourceRefs": [{"kind": "month", "month": "202606", "section": "dashboardSummary", "recordKey": "dashboardSummary.totalRespondents", "path": "data/202606.json#/dashboardSummary/totalRespondents"}, {"kind": "month", "month": "202606", "section": "dashboardSummary", "recordKey": "dashboardSummary.nps.score", "path": "data/202606.json#/dashboardSummary/nps/score"}, {"kind": "month", "month": "202606", "section": "satisfactionCrossData", "recordKey": "satisfactionCrossData.datasets[*].data", "path": "data/202606.json#/satisfactionCrossData"}, {"kind": "month", "month": "202606", "section": "branchLeaderboardData", "recordKey": "branchLeaderboardData[*]", "path": "data/202606.json#/branchLeaderboardData"}, {"kind": "month", "month": "202606", "section": "futureDestData", "recordKey": "futureDestData.labels+values", "path": "data/202606.json#/futureDestData"}, {"kind": "month", "month": "202606", "section": "rawFeedbacks", "recordKey": "rawFeedbacks[*].type", "path": "data/202606.json#/rawFeedbacks"}, {"kind": "month", "month": "202606", "section": "memberConsentCrossData", "recordKey": "memberConsentCrossData.datasets[*]", "path": "data/202606.json#/memberConsentCrossData"}, {"kind": "month", "month": "202606", "section": "customerSegments", "recordKey": "customerSegments['回頭客 (Repeat)']", "path": "data/202606.json#/customerSegments"}],
  "calculationNotes": ["Sentiment counts use explicit rawFeedbacks.type labels; rates use 47 labelled records.", "memberConsentCrossData is an observed joint member/consent source; no joint recommendation-to-consent or repeat-purchase source exists.", "overall_satisfaction is an unweighted mean of 40 observed numeric satisfactionCrossData cells, not a respondent-weighted total."]
}
